{"created_at":"2026-08-29T22:47:26Z","display_name":"Katsushi Kagaya","identity_id":"https://orcid.org/0000-0003-3001-7690","identity_version":1,"initial_credential_public_key":{"algorithm":-7,"jwk":{"crv":"P-256","kty":"EC","x":"Yx1KsW727K9Ie2ARZsvc2GVVv2tIYzdz8G7bmIGfTkA","y":"CeB37YVUqEdArDZtHPvQYc3LOH-fnhXrqxH9GjAq8Jw"}},"openpgp_primary_fingerprint":"85F79058BD83EB3889DEF766B065C54586067E2E","orcid_authenticated_at":"2026-08-29T22:47:26Z","recovery_code_commitment":"sha256:52a7baf5d0c3528d33f5f91734f852f78d28b5d8ee6b8e17759f60f34a8ace2e","rp_id":"proof.excyberlab.net","schema":"urn:skyseal:identity-genesis:v1"}
